{
  "schema_version": "0.1.0",
  "id": "example-public-read",
  "source_id": "sdka-example-source-pending-registration",
  "purpose": "Exemplo offline de contrato SDKA sujeito a autorizacao e catalogo institucional",
  "scope": {
    "allowed_hosts": [
      "example.org"
    ],
    "allowed_paths": [
      "/api/catalog"
    ],
    "methods": [
      "GET"
    ]
  },
  "authorization": {
    "basis": "publicly documented; permission must be independently confirmed",
    "approved_by": null
  },
  "execution": {
    "mode": "dry_run",
    "read_only": true,
    "timeout_seconds": 10,
    "max_requests": 10
  },
  "evidence": {
    "source_url": "https://example.org/api-docs",
    "redaction_required": true
  },
  "institution": "sertaodigital",
  "product_context": {
    "repository": "sertaodigitalorg/SD-Knowledge",
    "skill": "sertaodigital-core"
  }
}
